<?xml version="1.0" encoding="utf-8"?>
<extend-story name="/" xmlns:xsi="http://www.w3.org/2001/XMLSchema-instance"
              xsi:noNamespaceSchemaLocation="story.xsd">
    <!--Areas-->
    <include path="coc/desert.xml"/>
    <include path="coc/forest.xml"/>
    <extend-zone name="deepwoods">
        <lib name="strings">
            <text name="walk">
                You enjoy a peaceful walk in the deepwoods.  It gives you time to think over the recent, disturbing events.
                <dynStats tou="0.5" int="1"/>
            </text>
        </lib>
    </extend-zone>

    <!-- Monsters -->
    <include path="coc/monsters/goblin.xml"/>

    <!-- NPCs -->
    <include path="coc/NPC/celess.xml"/>
    <include path="coc/NPC/samirah.xml"/>
    <!--<include path="coc/NPC/diva.xml"/>-->
    <include path="coc/NPC/teladreshops.xml"/>

    <!--Other-->
    <include path="coc/appearance.xml"/>

    <!-- Modding -->
    <include path="modlist.xml" required="false"/>
</extend-story>